{
  "schema_version": 1,
  "checked_at": "2026-10-28T04:32:28Z",
  "scheduled_for": "2026-10-28T04:30:00Z",
  "run": {
    "trigger": "schedule",
    "run_id": "40632887569",
    "late": false,
    "late_seconds": 148,
    "missed_slots": [],
    "missed_count": 0,
    "collector_version": "1.0.0"
  },
  "providers": {
    "anthropic": {
      "id": "anthropic",
      "name": "Claude",
      "vendor": "Anthropic",
      "geeked_provider": "claude",
      "models": {
        "state": "unavailable",
        "source": "https://api.anthropic.com/v1/models",
        "error": "secret ANTHROPIC_API_KEY is not set",
        "items": []
      },
      "status": {
        "state": "ok",
        "source": "https://status.claude.com/api/v2/summary.json",
        "page_url": "https://status.claude.com",
        "error": null,
        "overall": "degraded",
        "summary": "Partially Degraded Service",
        "incidents": [
          {
            "id": "9ftx658xtd5z",
            "title": "Elevated errors affecting the Gmail connector",
            "status": "investigating",
            "impact": "minor",
            "url": "https://stspg.io/j86c100s8tqm",
            "started_at": "2026-10-28T03:59:32Z",
            "updated_at": "2026-10-28T04:06:55Z"
          }
        ],
        "affected_components": [
          {
            "name": "claude.ai",
            "status": "degraded_performance"
          },
          {
            "name": "Claude Code",
            "status": "degraded_performance"
          },
          {
            "name": "Claude Cowork",
            "status": "degraded_performance"
          }
        ]
      }
    },
    "openai": {
      "id": "openai",
      "name": "ChatGPT",
      "vendor": "OpenAI",
      "geeked_provider": "openai",
      "models": {
        "state": "unavailable",
        "source": "https://api.openai.com/v1/models",
        "error": "secret OPENAI_API_KEY is not set",
        "items": []
      },
      "status": {
        "state": "ok",
        "source": "https://status.openai.com/api/v2/summary.json",
        "page_url": "https://status.openai.com",
        "error": null,
        "overall": "operational",
        "summary": "All Systems Operational",
        "incidents": [],
        "affected_components": []
      }
    },
    "xai": {
      "id": "xai",
      "name": "Grok",
      "vendor": "xAI",
      "geeked_provider": "xai",
      "models": {
        "state": "unavailable",
        "source": "https://api.x.ai/v1/models",
        "error": "secret XAI_API_KEY is not set",
        "items": []
      },
      "status": {
        "state": "ok",
        "source": "https://status.x.ai/feed.xml",
        "page_url": "https://status.x.ai",
        "error": null,
        "overall": "operational",
        "summary": "All systems operational",
        "incidents": [],
        "affected_components": []
      }
    }
  },
  "changes": {
    "any": true,
    "summary": "ChatGPT operational (was degraded); ChatGPT: 1 incident(s) resolved",
    "previous_checked_at": "2026-10-28T04:02:18Z",
    "providers": {
      "anthropic": {
        "models_added": [],
        "models_removed": [],
        "status_changed": null,
        "incidents_started": [],
        "incidents_resolved": []
      },
      "openai": {
        "models_added": [],
        "models_removed": [],
        "status_changed": {
          "from": "degraded",
          "to": "operational"
        },
        "incidents_started": [],
        "incidents_resolved": [
          {
            "id": "01M609FPNJF29J5GDH979ZDYYK",
            "title": "Degraded Performace on ChatGPT Work"
          }
        ]
      },
      "xai": {
        "models_added": [],
        "models_removed": [],
        "status_changed": null,
        "incidents_started": [],
        "incidents_resolved": []
      }
    }
  }
}
