{
  "schema_version": 1,
  "checked_at": "2026-10-28T22:31:26Z",
  "scheduled_for": "2026-10-28T22:30:00Z",
  "run": {
    "trigger": "schedule",
    "run_id": "40780595703",
    "late": false,
    "late_seconds": 86,
    "missed_slots": [],
    "missed_count": 0,
    "collector_version": "1.0.0"
  },
  "providers": {
    "anthropic": {
      "id": "anthropic",
      "name": "Claude",
      "vendor": "Anthropic",
      "geeked_provider": "claude",
      "models": {
        "state": "unavailable",
        "source": "https://api.anthropic.com/v1/models",
        "error": "secret ANTHROPIC_API_KEY is not set",
        "items": []
      },
      "status": {
        "state": "ok",
        "source": "https://status.claude.com/api/v2/summary.json",
        "page_url": "https://status.claude.com",
        "error": null,
        "overall": "operational",
        "summary": "All Systems Operational",
        "incidents": [],
        "affected_components": []
      }
    },
    "openai": {
      "id": "openai",
      "name": "ChatGPT",
      "vendor": "OpenAI",
      "geeked_provider": "openai",
      "models": {
        "state": "unavailable",
        "source": "https://api.openai.com/v1/models",
        "error": "secret OPENAI_API_KEY is not set",
        "items": []
      },
      "status": {
        "state": "ok",
        "source": "https://status.openai.com/api/v2/summary.json",
        "page_url": "https://status.openai.com",
        "error": null,
        "overall": "operational",
        "summary": "All Systems Operational",
        "incidents": [],
        "affected_components": []
      }
    },
    "xai": {
      "id": "xai",
      "name": "Grok",
      "vendor": "xAI",
      "geeked_provider": "xai",
      "models": {
        "state": "unavailable",
        "source": "https://api.x.ai/v1/models",
        "error": "secret XAI_API_KEY is not set",
        "items": []
      },
      "status": {
        "state": "ok",
        "source": "https://status.x.ai/feed.xml",
        "page_url": "https://status.x.ai",
        "error": null,
        "overall": "degraded",
        "summary": "5 active incident(s)",
        "incidents": [
          {
            "id": "ps_d25569b21cabd283",
            "title": "[Automations] Multiple services degraded",
            "status": "active",
            "impact": "minor",
            "url": "https://status.x.ai/automations/ps_d25569b21cabd283",
            "started_at": "2026-10-28T21:15:10Z",
            "updated_at": "2026-10-28T21:15:10Z"
          },
          {
            "id": "ps_d25569b21cabd283",
            "title": "[BugBot] Multiple services degraded",
            "status": "active",
            "impact": "minor",
            "url": "https://status.x.ai/bugbot/ps_d25569b21cabd283",
            "started_at": "2026-10-28T21:15:10Z",
            "updated_at": "2026-10-28T21:15:10Z"
          },
          {
            "id": "ps_d25569b21cabd283",
            "title": "[Cloud Agents] Multiple services degraded",
            "status": "active",
            "impact": "minor",
            "url": "https://status.x.ai/cloud-agents/ps_d25569b21cabd283",
            "started_at": "2026-10-28T21:15:10Z",
            "updated_at": "2026-10-28T21:15:10Z"
          },
          {
            "id": "ps_d25569b21cabd283",
            "title": "[Grok Bot] Multiple services degraded",
            "status": "active",
            "impact": "minor",
            "url": "https://status.x.ai/grok-bot/ps_d25569b21cabd283",
            "started_at": "2026-10-28T21:15:10Z",
            "updated_at": "2026-10-28T21:15:10Z"
          },
          {
            "id": "ps_d25569b21cabd283",
            "title": "[Origin] Multiple services degraded",
            "status": "active",
            "impact": "minor",
            "url": "https://status.x.ai/origin/ps_d25569b21cabd283",
            "started_at": "2026-10-28T21:15:10Z",
            "updated_at": "2026-10-28T21:15:10Z"
          }
        ],
        "affected_components": []
      }
    }
  },
  "changes": {
    "any": false,
    "summary": "no changes",
    "previous_checked_at": "2026-10-28T22:02:15Z",
    "providers": {
      "anthropic": {
        "models_added": [],
        "models_removed": [],
        "status_changed": null,
        "incidents_started": [],
        "incidents_resolved": []
      },
      "openai": {
        "models_added": [],
        "models_removed": [],
        "status_changed": null,
        "incidents_started": [],
        "incidents_resolved": []
      },
      "xai": {
        "models_added": [],
        "models_removed": [],
        "status_changed": null,
        "incidents_started": [],
        "incidents_resolved": []
      }
    }
  }
}
