{
  "schema_version": 1,
  "checked_at": "2026-10-25T08:38:21Z",
  "scheduled_for": "2026-10-25T08:30:00Z",
  "run": {
    "trigger": "schedule",
    "run_id": "40177408145",
    "late": false,
    "late_seconds": 501,
    "missed_slots": [],
    "missed_count": 0,
    "collector_version": "1.0.0"
  },
  "providers": {
    "anthropic": {
      "id": "anthropic",
      "name": "Claude",
      "vendor": "Anthropic",
      "geeked_provider": "claude",
      "models": {
        "state": "unavailable",
        "source": "https://api.anthropic.com/v1/models",
        "error": "secret ANTHROPIC_API_KEY is not set",
        "items": []
      },
      "status": {
        "state": "ok",
        "source": "https://status.claude.com/api/v2/summary.json",
        "page_url": "https://status.claude.com",
        "error": null,
        "overall": "partial_outage",
        "summary": "All Systems Operational",
        "incidents": [
          {
            "id": "vx06kp8wfpq2",
            "title": "Elevated errors for Claude Fable 5.1",
            "status": "monitoring",
            "impact": "major",
            "url": "https://stspg.io/y0gkl12ztjst",
            "started_at": "2026-10-25T08:17:08Z",
            "updated_at": "2026-10-25T08:30:47Z"
          }
        ],
        "affected_components": []
      }
    },
    "openai": {
      "id": "openai",
      "name": "ChatGPT",
      "vendor": "OpenAI",
      "geeked_provider": "openai",
      "models": {
        "state": "unavailable",
        "source": "https://api.openai.com/v1/models",
        "error": "secret OPENAI_API_KEY is not set",
        "items": []
      },
      "status": {
        "state": "ok",
        "source": "https://status.openai.com/api/v2/summary.json",
        "page_url": "https://status.openai.com",
        "error": null,
        "overall": "operational",
        "summary": "All Systems Operational",
        "incidents": [],
        "affected_components": []
      }
    },
    "xai": {
      "id": "xai",
      "name": "Grok",
      "vendor": "xAI",
      "geeked_provider": "xai",
      "models": {
        "state": "unavailable",
        "source": "https://api.x.ai/v1/models",
        "error": "secret XAI_API_KEY is not set",
        "items": []
      },
      "status": {
        "state": "ok",
        "source": "https://status.x.ai/feed.xml",
        "page_url": "https://status.x.ai",
        "error": null,
        "overall": "operational",
        "summary": "All systems operational",
        "incidents": [],
        "affected_components": []
      }
    }
  },
  "changes": {
    "any": true,
    "summary": "Claude partial outage (was operational); Claude: 1 new incident(s)",
    "previous_checked_at": "2026-10-25T08:02:54Z",
    "providers": {
      "anthropic": {
        "models_added": [],
        "models_removed": [],
        "status_changed": {
          "from": "operational",
          "to": "partial_outage"
        },
        "incidents_started": [
          {
            "id": "vx06kp8wfpq2",
            "title": "Elevated errors for Claude Fable 5.1"
          }
        ],
        "incidents_resolved": []
      },
      "openai": {
        "models_added": [],
        "models_removed": [],
        "status_changed": null,
        "incidents_started": [],
        "incidents_resolved": []
      },
      "xai": {
        "models_added": [],
        "models_removed": [],
        "status_changed": null,
        "incidents_started": [],
        "incidents_resolved": []
      }
    }
  }
}
