{
  "schema_version": 1,
  "checked_at": "2026-10-28T16:32:05Z",
  "scheduled_for": "2026-10-28T16:30:00Z",
  "run": {
    "trigger": "schedule",
    "run_id": "40726879449",
    "late": false,
    "late_seconds": 125,
    "missed_slots": [],
    "missed_count": 0,
    "collector_version": "1.0.0"
  },
  "providers": {
    "anthropic": {
      "id": "anthropic",
      "name": "Claude",
      "vendor": "Anthropic",
      "geeked_provider": "claude",
      "models": {
        "state": "unavailable",
        "source": "https://api.anthropic.com/v1/models",
        "error": "secret ANTHROPIC_API_KEY is not set",
        "items": []
      },
      "status": {
        "state": "ok",
        "source": "https://status.claude.com/api/v2/summary.json",
        "page_url": "https://status.claude.com",
        "error": null,
        "overall": "degraded",
        "summary": "Partially Degraded Service",
        "incidents": [
          {
            "id": "phg1y2yh07n2",
            "title": "Elevated errors affecting the Google Calendar connector",
            "status": "investigating",
            "impact": "minor",
            "url": "https://stspg.io/75qq31h8672d",
            "started_at": "2026-10-28T16:19:09Z",
            "updated_at": "2026-10-28T16:19:10Z"
          }
        ],
        "affected_components": [
          {
            "name": "claude.ai",
            "status": "degraded_performance"
          },
          {
            "name": "Claude Code",
            "status": "degraded_performance"
          },
          {
            "name": "Claude Cowork",
            "status": "degraded_performance"
          }
        ]
      }
    },
    "openai": {
      "id": "openai",
      "name": "ChatGPT",
      "vendor": "OpenAI",
      "geeked_provider": "openai",
      "models": {
        "state": "unavailable",
        "source": "https://api.openai.com/v1/models",
        "error": "secret OPENAI_API_KEY is not set",
        "items": []
      },
      "status": {
        "state": "ok",
        "source": "https://status.openai.com/api/v2/summary.json",
        "page_url": "https://status.openai.com",
        "error": null,
        "overall": "operational",
        "summary": "All Systems Operational",
        "incidents": [],
        "affected_components": []
      }
    },
    "xai": {
      "id": "xai",
      "name": "Grok",
      "vendor": "xAI",
      "geeked_provider": "xai",
      "models": {
        "state": "unavailable",
        "source": "https://api.x.ai/v1/models",
        "error": "secret XAI_API_KEY is not set",
        "items": []
      },
      "status": {
        "state": "ok",
        "source": "https://status.x.ai/feed.xml",
        "page_url": "https://status.x.ai",
        "error": null,
        "overall": "operational",
        "summary": "All systems operational",
        "incidents": [],
        "affected_components": []
      }
    }
  },
  "changes": {
    "any": true,
    "summary": "Claude degraded (was operational); Claude: 1 new incident(s)",
    "previous_checked_at": "2026-10-28T16:02:20Z",
    "providers": {
      "anthropic": {
        "models_added": [],
        "models_removed": [],
        "status_changed": {
          "from": "operational",
          "to": "degraded"
        },
        "incidents_started": [
          {
            "id": "phg1y2yh07n2",
            "title": "Elevated errors affecting the Google Calendar connector"
          }
        ],
        "incidents_resolved": []
      },
      "openai": {
        "models_added": [],
        "models_removed": [],
        "status_changed": null,
        "incidents_started": [],
        "incidents_resolved": []
      },
      "xai": {
        "models_added": [],
        "models_removed": [],
        "status_changed": null,
        "incidents_started": [],
        "incidents_resolved": []
      }
    }
  }
}
